,name,link,Academics,Value,Diversity,Campus,Athletics,Party_Scene,Professors,Location,Dorms,Campus_Food,Student_Life,Safety,des,street,city,state,zip,Accept_Rate,SAT,ACT,Application_fee,Price_per_year,major_rank,Acceptance Rate,Total_Applicants,SAT Range,SAT Reading,SAT Math,Students Submitting SAT
91,St. Olaf College,https://www.niche.com/colleges/st-olaf-college/,A,A,A-,A,B-,C+,A-,C+,A-,A+,B+,B,"St. Olaf is a highly rated private, Christian college located in Northfield, Minnesota. It is a small institution with an enrollment of 3,003 undergraduate students. Admissions is fairly competitive as the St. Olaf acceptance rate is 43%. Popular majors include Biology, Economics, and Psychology. Graduating 88% of students, St. Olaf alumni go on to earn a starting salary of $37,100.",1520 St Olaf Ave,Northfield,MN,55057,43%,1150-1400,25-31,$0 ,"$27,587 ",Biology; Economics; Psychology; Mathematics; Political Science and Government; Chemistry; English; Environmental Science; Arts; History; ,43%,"5,949",1150-1400,580-690,570-710,27%
92,University of California - Irvine,https://www.niche.com/colleges/university-of-california---irvine/,A,A+,A,A-,B,B-,A,B+,B+,A-,A-,B,"UC Irvine is a highly rated public university located in Irvine, California in the Los Angeles Area. It is a large institution with an enrollment of 28,855 undergraduate students. Admissions is fairly competitive as the UC Irvine acceptance rate is 37%. Popular majors include Social Psychology, Biology, and Public Health. Graduating 85% of students, UC Irvine alumni go on to earn a starting salary of $38,500.",501 Aldrich Hall,Irvine,CA,92697,37%,1170-1350,25-32,$70 ,"$13,944 ",Social Psychology; Biology; Public Health; Managerial Economics; Computer Science; Criminology; Economics; Education; Political Science and Government; Mechanical Engineering; ,37%,"85,092",1170-1350,580-650,590-700,86%
93,Florida State University,https://www.niche.com/colleges/florida-state-university/,A,A,A,A,A+,A+,A,B,B,A-,A+,C+,"Florida State is a highly rated public university located in Tallahassee, Florida. It is a large institution with an enrollment of 29,286 undergraduate students. Admissions is fairly competitive as the Florida State acceptance rate is 49%. Popular majors include Psychology, Finance, and Marketing. Graduating 80% of students, Florida State alumni go on to earn a starting salary of $35,000.",600 W College Ave,Tallahassee,FL,32306,49%,1190-1330,26-30,$30 ,"$16,450 ",Psychology; Finance; Marketing; Criminal Justice and Safety Studies; English; International Relations; Political Science and Government; Biology; Social Science Research Methods; Liberal Arts and Humanities; ,49%,"35,334",1190-1330,600-670,590-660,38%
94,University of California - San Diego,https://www.niche.com/colleges/university-of-california---san-diego/,A,A,A,B-,B,B-,A,A-,C+,B,B,B-,"UC San Diego is a highly rated public university located in San Diego, California. It is a large institution with an enrollment of 27,880 undergraduate students. Admissions is fairly competitive as the UC San Diego acceptance rate is 34%. Popular majors include Computer Science, Economics, and Biochemistry and Molecular Biology. Graduating 85% of students, UC San Diego alumni go on to earn a starting salary of $39,600.",9500 Gilman Dr,La Jolla,CA,92093,34%,1210-1410,27-33,$70 ,"$14,616 ",Computer Science; Economics; Biochemistry and Molecular Biology; Anatomy; Biology; Communications; Management Sciences and Information Systems; Political Science and Government; Electrical Engineering; Neuroscience and Neurobiology; ,34%,"88,446",1210-1410,600-680,610-730,84%
95,California Polytechnic State University - San Luis Obispo,https://www.niche.com/colleges/california-polytechnic-state-university---san-luis-obispo/,A,A+,A-,B,B+,A,B,A,B-,D+,A,B,"Cal Poly is a highly rated public university located in California. It is a large institution with an enrollment of 20,584 undergraduate students. Admissions is fairly competitive as the Cal Poly acceptance rate is 35%. Popular majors include Business, Mechanical Engineering, and Biology. Graduating 79% of students, Cal Poly alumni go on to earn a starting salary of $48,600.",1 Grand Avenue,San Luis Obispo,CA,93407,35%,1200-1380,26-31,$55 ,"$19,002 ",Business; Mechanical Engineering; Biology; Agricultural Business; Computer Science; Electrical Engineering; Animal Sciences and Husbandry; Physical Education Teaching and Coaching; Psychology; Architecture; ,35%,"48,588",1200-1380,600-680,600-700,70%
96,University of Delaware,https://www.niche.com/colleges/university-of-delaware/,A-,A,A-,A,A,A+,A,B+,B,B+,A+,B-,"UD is a highly rated public university located in Newark, Delaware in the Philadelphia Area. It is a large institution with an enrollment of 18,195 undergraduate students. Admissions is somewhat competitive as the UD acceptance rate is 63%. Popular majors include Liberal Arts and Humanities, Finance, and Marketing. Graduating 82% of students, UD alumni go on to earn a starting salary of $43,900.",104 Hullihen Hall,Newark,DE,19716,63%,1130-1330,25-29,$75 ,"$16,286 ",Liberal Arts and Humanities; Finance; Marketing; Nursing; Research and Experimental Psychology; Kinesiology and Exercise Science; Elementary Education; Biology; Behavioral Sciences; Communications; ,63%,"27,803",1130-1330,570-660,560-670,70%
97,Iowa State University,https://www.niche.com/colleges/iowa-state-university/,A-,A,A-,A,A,A,A,A-,B+,A,A+,B,"Iowa State is a highly rated public university located in Ames, Iowa. It is a large institution with an enrollment of 28,743 undergraduate students. The Iowa State acceptance rate is 89%. Popular majors include Mechanical Engineering, Kinesiology and Exercise Science, and Marketing. Graduating 73% of students, Iowa State alumni go on to earn a starting salary of $39,100.",1750 Beardshear Hall,Ames,IA,50010,89%,1160-1410,22-28,$40 ,"$13,949 ",Mechanical Engineering; Kinesiology and Exercise Science; Marketing; Agricultural Business; Liberal Arts and Humanities; Psychology; Finance; Animal Sciences and Husbandry; Elementary Education; Accounting; ,89%,"19,262",1160-1410,600-700,560-710,9%
98,American University,https://www.niche.com/colleges/american-university/,A+,A,A,B-,B,A,A-,A+,C+,C+,A-,B-,"American is a highly rated private, Christian university located in Washington, D.C. It is a mid-size institution with an enrollment of 7,764 undergraduate students. Admissions is competitive as the American acceptance rate is 29%. Popular majors include International Relations, Business, and Political Science and Government. Graduating 79% of students, American alumni go on to earn a starting salary of $43,800.",4400 Massachusetts Ave NW,Washington,DC,20016,29%,1180-1350,26-30,$70 ,"$32,732 ",International Relations; Business; Political Science and Government; Liberal Arts and Humanities; Economics; Psychology; Public Health; Communications; Public Relations; Film and Video Studies; ,29%,"18,699",1180-1350,610-690,570-660,49%
99,Texas Christian University,https://www.niche.com/colleges/texas-christian-university/,A,A-,A-,A+,A+,A,A-,B+,A,B+,A+,B-,"Texas Christian is a highly rated private, Christian university located in Fort Worth, Texas. It is a mid-size institution with an enrollment of 8,738 undergraduate students. Admissions is fairly competitive as the Texas Christian acceptance rate is 41%. Popular majors include Nursing, Communications, and Finance. Graduating 83% of students, Texas Christian alumni go on to earn a starting salary of $44,800.",2800 S University Dr,Fort Worth,TX,76129,41%,1130-1330,25-30,$50 ,"$35,363 ",Nursing; Communications; Finance; Economics; Accounting; Management Sciences and Information Systems; Public Relations; Marketing; Political Science and Government; Psychology; ,41%,"19,740",1130-1330,570-660,560-670,32%
100,Syracuse University,https://www.niche.com/colleges/syracuse-university/,A,A,A,B+,A+,A+,A,B,B-,B-,A+,C+,"Syracuse is a highly rated private university located in Syracuse, New York. It is a large institution with an enrollment of 14,675 undergraduate students. Admissions is fairly competitive as the Syracuse acceptance rate is 47%. Popular majors include Information Science, Psychology, and Finance. Graduating 83% of students, Syracuse alumni go on to earn a starting salary of $43,400.",900 South Crouse Ave.,Syracuse,NY,13244,47%,1160-1350,25-30,$75 ,"$35,306 ",Information Science; Psychology; Finance; Economics; Marketing; Political Science and Government; Radio and Television; International Relations; Biology; Architecture; ,47%,"33,099",1160-1350,580-670,580-680,66%
101,University of Massachusetts - Amherst,https://www.niche.com/colleges/university-of-massachusetts---amherst/,A,A,A,A,A-,A+,A,B+,B,A+,A+,B,"UMass is a highly rated public university located in Amherst Center, Massachusetts in the Springfield, MA Area. It is a large institution with an enrollment of 21,577 undergraduate students. Admissions is fairly competitive as the UMass acceptance rate is 58%. Popular majors include Psychology, Liberal Arts and Humanities, and Economics. Graduating 77% of students, UMass alumni go on to earn a starting salary of $38,800.",374 Whitmore Building 181 Presidents Drive,Amherst,MA,1003,58%,1180-1360,26-31,$80 ,"$21,281 ",Psychology; Liberal Arts and Humanities; Economics; Communications; Public Health; Finance; Biology; Political Science and Government; Exercise Physiology; Computer Science; ,58%,"42,043",1180-1360,590-670,590-690,85%
102,Wabash College,https://www.niche.com/colleges/wabash-college/,A,A,A-,B+,NG,B,A,C+,A,B+,A,B,"Wabash is a highly rated private college located in Crawfordsville, Indiana. It is a small institution with an enrollment of 864 undergraduate students. Admissions is somewhat competitive as the Wabash acceptance rate is 63%. Popular majors include Mathematics, Economics, and Biology. Graduating 77% of students, Wabash alumni go on to earn a starting salary of $40,600.",301 West Wabash Avenue,Crawfordsville,IN,47933,63%,1070-1280,23-28,$50 ,"$24,603 ",Mathematics; Economics; Biology; Political Science and Government; Rhetoric and Composition; History; Research and Experimental Psychology; Spanish Language and Literature; Chemistry; Physics; ,63%,"1,304",1070-1280,530-630,540-650,77%
103,Denison University,https://www.niche.com/colleges/denison-university/,A,A,A,B-,B,B,A-,C+,C+,C-,B,A,"Denison is a highly rated private university located in Granville, Ohio. It is a small institution with an enrollment of 2,319 undergraduate students. Admissions is fairly competitive as the Denison acceptance rate is 37%. Popular majors include Economics, Communications, and Psychology. Graduating 86% of students, Denison alumni go on to earn a starting salary of $35,400.",100 W College Street,Granville,OH,43023,37%,1200-1380,28-31,$0 ,"$32,290 ",Economics; Communications; Psychology; Biology; Political Science and Government; Sociology; Environmental Science; Education; Professional and Technical Writing; Spanish Language and Literature; ,37%,"7,540",1200-1380,600-690,600-690,35%
104,Gustavus Adolphus College,https://www.niche.com/colleges/gustavus-adolphus-college/,A,A+,A-,A-,B,B,A,C+,B+,A+,A-,B-,"Gustavus is a highly rated private, Christian college located in St. Peter, Minnesota. It is a small institution with an enrollment of 2,150 undergraduate students. Admissions is somewhat competitive as the Gustavus acceptance rate is 68%. Popular majors include Business, Psychology, and Biology. Graduating 80% of students, Gustavus alumni go on to earn a starting salary of $38,800.",800 West College Avenue,Saint Peter,MN,56082,68%,1080-1340,26-30,$0 ,"$29,894 ",Business; Psychology; Biology; Communications; Nursing; Accounting; Economics; Chemistry; Physical Education Teaching and Coaching; English; ,68%,"4,834",1080-1340,570-700,570-670,6%
105,Bentley University,https://www.niche.com/colleges/bentley-university/,A-,A+,A-,B-,B+,A-,B,B+,A-,D+,A-,B+,"Bentley is a highly rated private university located in Waltham, Massachusetts in the Boston Area. It is a small institution with an enrollment of 4,171 undergraduate students. Admissions is fairly competitive as the Bentley acceptance rate is 44%. Popular majors include Accounting, Finance, and Business Support Services. Graduating 91% of students, Bentley alumni go on to earn a starting salary of $62,200.",175 Forest St,Waltham,MA,2452,44%,1210-1380,27-31,$50 ,"$36,613 ",Accounting; Finance; Business Support Services; Marketing; Business; Liberal Arts and Humanities; Managerial Economics; Information Science; Corporate Communications; Actuarial Science; ,44%,"8,867",1210-1380,590-670,620-710,66%
106,Auburn University,https://www.niche.com/colleges/auburn-university/,A-,A,A-,A,A+,A,A,B+,B,A,A+,B,"Auburn is a highly rated public university located in Auburn, Alabama. It is a large institution with an enrollment of 21,762 undergraduate students. The Auburn acceptance rate is 84%. Popular majors include Biomedical Sciences and Molecular Medicine, Business, and Accounting. Graduating 77% of students, Auburn alumni go on to earn a starting salary of $37,500.","Auburn, Alabama",Auburn,AL,36849,84%,1130-1310,24-30,$50 ,"$22,613 ",Biomedical Sciences and Molecular Medicine; Business; Accounting; Finance; Exercise Physiology; Mechanical Engineering; Marketing; Nursing; Logistics and Supply Chain Management; Communications; ,84%,"18,072",1130-1310,570-650,560-660,12%
107,Oberlin College,https://www.niche.com/colleges/oberlin-college/,A+,A-,A,B-,B-,C,A,C,C+,B,B,C+,"Oberlin is a highly rated private college located in Oberlin, Ohio in the Cleveland Area. It is a small institution with an enrollment of 2,790 undergraduate students. Admissions is fairly competitive as the Oberlin acceptance rate is 34%. Popular majors include Music Performance, Biology, and Political Science and Government. Graduating 86% of students, Oberlin alumni go on to earn a starting salary of $26,400.",70 N Professor St,Oberlin,OH,44074,34%,1280-1450,28-33,$0 ,"$39,794 ",Music Performance; Biology; Political Science and Government; Environmental Science; History; Economics; English; Psychology; Neuroscience and Neurobiology; Music; ,34%,"7,762",1280-1450,650-720,630-730,54%
108,James Madison University,https://www.niche.com/colleges/james-madison-university/,B+,A+,A-,A+,A,A+,A-,B,B+,A+,A+,B,"James Madison is a highly rated public university located in Harrisonburg, Virginia. It is a large institution with an enrollment of 18,905 undergraduate students. Admissions is somewhat competitive as the James Madison acceptance rate is 75%. Popular majors include Community Health Services and Counseling, Communications, and Liberal Arts and Humanities. Graduating 83% of students, James Madison alumni go on to earn a starting salary of $42,400.",800 South Main Street,Harrisonburg,VA,22807,75%,1100-1260,23-28,$70 ,"$16,154 ",Community Health Services and Counseling; Communications; Liberal Arts and Humanities; Nursing; Psychology; Information Science; Biology; Finance; Marketing; Sport and Fitness Management; ,75%,"21,100",1100-1260,560-640,540-620,87%
109,Pepperdine University,https://www.niche.com/colleges/pepperdine-university/,A,A,A,B,B,C+,A-,C,B,B,B+,B+,"Pepperdine is a highly rated private, Christian university located in California. It is a small institution with an enrollment of 3,300 undergraduate students. Admissions is fairly competitive as the Pepperdine acceptance rate is 40%. Popular majors include Business, Psychology, and Public Relations. Graduating 85% of students, Pepperdine alumni go on to earn a starting salary of $45,300.",24255 Pacific Coast Hwy,Malibu,CA,90263,40%,1200-1390,26-31,$65 ,"$36,372 ",Business; Psychology; Public Relations; Kinesiology and Exercise Science; Economics; Advertising; International Studies; Political Science and Government; Biology; International Business; ,40%,"11,704",1200-1390,600-690,600-700,60%
110,Saint Louis University,https://www.niche.com/colleges/saint-louis-university/,A,A,A-,B,B+,B+,A+,A-,B-,B,A-,C+,"Saint Louis is a highly rated private, Catholic university located in St. Louis, Missouri. It is a mid-size institution with an enrollment of 6,625 undergraduate students. Admissions is somewhat competitive as the Saint Louis acceptance rate is 64%. Popular majors include Business, Nursing, and Kinesiology and Exercise Science. Graduating 77% of students, Saint Louis alumni go on to earn a starting salary of $43,300.",1 N. Grand Blvd.,St. Louis,MO,63103,64%,1170-1390,25-31,$0 ,"$31,718 ",Business; Nursing; Kinesiology and Exercise Science; Biology; Psychology; Public Health; Communications; Healthcare Management; Occupational Therapy; Bioengineering and Biomedical Engineering; ,64%,"13,431",1170-1390,590-690,580-700,13%
111,University of Portland,https://www.niche.com/colleges/university-of-portland/,A-,A,A,A-,A-,B,A-,A,B+,A,A,B+,"University of Portland is a highly rated private, Catholic university located in Portland, Oregon. It is a small institution with an enrollment of 3,792 undergraduate students. Admissions is somewhat competitive as the University of Portland acceptance rate is 70%. Popular majors include Nursing, Biology, and Psychology. Graduating 82% of students, University of Portland alumni go on to earn a starting salary of $50,700.",5000 N Willamette Blvd,Portland,OR,97203,70%,1140-1320,23-29,$50 ,"$33,327 ",Nursing; Biology; Psychology; Computational and Applied Mathematics; Marketing; Mechanical Engineering; Spanish Language and Literature; Management Sciences and Information Systems; Civil Engineering; Computer Science; ,70%,"11,137",1140-1320,580-660,560-660,70%
112,University of Oklahoma,https://www.niche.com/colleges/university-of-oklahoma/,A,A-,A,A,A+,A,A-,B,B-,A,A+,B,"Oklahoma is a highly rated public university located in Oklahoma. It is a large institution with an enrollment of 19,065 undergraduate students. Admissions is somewhat competitive as the Oklahoma acceptance rate is 74%. Popular majors include Liberal Arts and Humanities, Organizational Behavior Studies, and Finance. Graduating 67% of students, Oklahoma alumni go on to earn a starting salary of $39,800.",660 Parrington Oval,Norman,OK,73069,74%,1150-1380,23-29,$40 ,"$20,003 ",Liberal Arts and Humanities; Organizational Behavior Studies; Finance; Journalism; Mining and Petroleum Engineering; Marketing; Psychology; Kinesiology and Exercise Science; Communications; Zoology and Entomology; ,74%,"15,579",1150-1380,580-690,570-690,28%
113,University of Denver,https://www.niche.com/colleges/university-of-denver/,A,A,A,A-,A-,A,A,A,B,B,A,C+,"University of Denver is a highly rated private university located in Denver, Colorado. It is a mid-size institution with an enrollment of 5,494 undergraduate students. Admissions is fairly competitive as the University of Denver acceptance rate is 58%. Popular majors include Finance, Psychology, and International Relations. Graduating 75% of students, University of Denver alumni go on to earn a starting salary of $44,900.",2199 S. University Blvd,Denver,CO,80208,58%,1160-1350,25-30,$65 ,"$35,163 ",Finance; Psychology; International Relations; Marketing; Communications; Biology; English; Accounting; Political Science and Government; Economics; ,58%,"19,904",1160-1350,590-680,570-670,33%
114,University of San Diego,https://www.niche.com/colleges/university-of-san-diego/,A,A,A,A+,B+,B+,A-,A,A,A+,A-,B,"USD is a highly rated private, Catholic university located in San Diego, California. It is a mid-size institution with an enrollment of 5,605 undergraduate students. Admissions is fairly competitive as the USD acceptance rate is 50%. Popular majors include Finance, Business, and Marketing. Graduating 82% of students, USD alumni go on to earn a starting salary of $48,300.",5998 Alcala Park,San Diego,CA,92110,50%,1180-1350,26-30,$55 ,"$38,592 ",Finance; Business; Marketing; Communications; Accounting; Biology; Psychology; Neuroscience and Neurobiology; English; Mechanical Engineering; ,50%,"14,739",1180-1350,590-670,590-680,49%
115,Oklahoma State University,https://www.niche.com/colleges/oklahoma-state-university/,A-,A,A,A,A+,A,A,B-,B,A-,A+,B,"Oklahoma State is a highly rated public university located in Stillwater, Oklahoma. It is a large institution with an enrollment of 18,221 undergraduate students. Admissions is somewhat competitive as the Oklahoma State acceptance rate is 74%. Popular majors include Business, Marketing, and Liberal Arts and Humanities. Graduating 62% of students, Oklahoma State alumni go on to earn a starting salary of $36,900.",107 Whitehurst,Stillwater,OK,74078,74%,1070-1260,22-28,$40 ,"$14,513 ",Business; Marketing; Liberal Arts and Humanities; Finance; Mechanical Engineering; Animal Sciences and Husbandry; Accounting; Psychology; Information Technology; Public Relations; ,74%,"13,635",1070-1260,540-630,530-630,21%
116,Washington State University,https://www.niche.com/colleges/washington-state-university/,A-,A,A,A-,A+,A+,A+,B,B,B+,A+,B,"Washington State is a highly rated public university located in Pullman, Washington. It is a large institution with an enrollment of 22,166 undergraduate students. Admissions is somewhat competitive as the Washington State acceptance rate is 73%. Popular majors include Psychology, Social Science Research Methods, and Nursing. Graduating 62% of students, Washington State alumni go on to earn a starting salary of $38,700.",French Administration Building,Pullman,WA,99164,73%,1020-1220,20-26,$50 ,"$17,885 ",Psychology; Social Science Research Methods; Nursing; Communications; Human Development; Mechanical Engineering; Hospitality and Tourism Management; Accounting; Police and Criminal Science; Elementary Education; ,73%,"22,565",1020-1220,510-610,510-610,78%
117,University of Alabama - Birmingham,https://www.niche.com/colleges/university-of-alabama---birmingham/,A,B+,A,A-,A,B+,A+,B,B+,A-,A,B-,"Alabama - Birmingham is a highly rated public university located in Birmingham, Alabama. It is a mid-size institution with an enrollment of 9,677 undergraduate students. The Alabama - Birmingham acceptance rate is 92%. Popular majors include Nursing, Psychology, and Business. Graduating 53% of students, Alabama - Birmingham alumni go on to earn a starting salary of $34,000.",Administration Bldg Suite 1070,Birmingham,AL,35294,92%,990-1370,21-28,$30 ,"$17,016 ",Nursing; Psychology; Business; Healthcare Management; Biology; Accounting; Marketing; Physical Education Teaching and Coaching; Communications; Management Sciences and Information Systems; ,92%,"7,555",990-1370,440-630,550-740,1%
118,University of South Florida,https://www.niche.com/colleges/university-of-south-florida/,A,A-,A,A-,A,A-,A,B+,B,B+,A,B-,"South Florida is a highly rated public university located in Tampa, Florida. It is a large institution with an enrollment of 24,672 undergraduate students. Admissions is fairly competitive as the South Florida acceptance rate is 45%. Popular majors include Health Service Preparatory Studies, Biomedical Sciences and Molecular Medicine, and Nursing. Graduating 71% of students, South Florida alumni go on to earn a starting salary of $34,600.",4202 East Fowler Ave,Tampa,FL,33620,45%,1150-1310,24-29,$30 ,"$11,766 ",Health Service Preparatory Studies; Biomedical Sciences and Molecular Medicine; Nursing; Liberal Arts and Humanities; Communications; Psychology; Public Health; Finance; Business; Biology; ,45%,"31,944",1150-1310,580-650,570-660,59%
119,University of Dayton,https://www.niche.com/colleges/university-of-dayton/,A-,A,A-,A,A-,A+,A-,B-,A,A+,A+,C+,"Dayton is a highly rated private, Catholic university located in Dayton, Ohio. It is a mid-size institution with an enrollment of 8,079 undergraduate students. Admissions is somewhat competitive as the Dayton acceptance rate is 72%. Popular majors include Mechanical Engineering, Finance, and Marketing. Graduating 79% of students, Dayton alumni go on to earn a starting salary of $42,900.",300 College Park,Dayton,OH,45469,72%,1100-1310,24-29,$0 ,"$35,077 ",Mechanical Engineering; Finance; Marketing; Communications; Psychology; Accounting; Chemical Engineering; Biology; Electrical Engineering; Civil Engineering; ,72%,"15,942",1100-1310,550-650,550-660,28%
120,Furman University,https://www.niche.com/colleges/furman-university/,A,A-,B+,A-,B+,B+,A,B+,B+,B,A-,C+,"Furman is a highly rated private university located in South Carolina. It is a small institution with an enrollment of 2,658 undergraduate students. Admissions is somewhat competitive as the Furman acceptance rate is 61%. Popular majors include Business, Political Science and Government, and Health Professions. Graduating 81% of students, Furman alumni go on to earn a starting salary of $36,400.",3300 Poinsett Highway,Greenville,SC,29613,61%,1190-1380,26-31,$50 ,"$32,951 ",Business; Political Science and Government; Health Professions; Communications; Biology; Psychology; Accounting; Spanish Language and Literature; Economics; Elementary Education; ,61%,"5,002",1190-1380,600-690,590-690,41%
121,Miami University,https://www.niche.com/colleges/miami-university/,A,A,A-,A,A-,A+,A-,B,B+,A,A,B-,"Miami is a highly rated public university located in Oxford, Ohio. It is a large institution with an enrollment of 16,619 undergraduate students. Admissions is somewhat competitive as the Miami acceptance rate is 68%. Popular majors include Marketing, Finance, and Public Relations. Graduating 79% of students, Miami alumni go on to earn a starting salary of $36,000.",501 East High St,Oxford,OH,45056,68%,1190-1380,26-31,$50 ,"$20,316 ",Marketing; Finance; Public Relations; Accounting; Psychology; Kinesiology and Exercise Science; Pre-Medicine Studies; Management Sciences and Information Systems; Early Childhood Education; Political Science and Government; ,68%,"30,255",1190-1380,580-670,610-710,23%
