,name,link,Academics,Value,Diversity,Campus,Athletics,Party_Scene,Professors,Location,Dorms,Campus_Food,Student_Life,Safety,des,street,city,state,zip,Accept_Rate,SAT,ACT,Application_fee,Price_per_year,major_rank,Acceptance Rate,Total_Applicants,SAT Range,SAT Reading,SAT Math,Students Submitting SAT
0,Massachusetts Institute of Technology,https://www.niche.com/colleges/massachusetts-institute-of-technology/,A+,A+,A+,A-,B,A,A+,A+,A,B,A+,B,"MIT is an elite private college located in Cambridge, Massachusetts in the Boston Area. It is a small institution with an enrollment of 4,510 undergraduate students. Admissions is extremely competitive as the MIT acceptance rate is only 7%. Popular majors include Computer Science, Mechanical Engineering, and Mathematics. Graduating 94% of students, MIT alumni go on to earn a starting salary of $79,800.",77 Massachusetts Avenue,Cambridge,MA,2139,7%,1490-1570,33-35,$75 ,"$22,230 ",Computer Science; Mechanical Engineering; Mathematics; Electrical Engineering; Physics; Aerospace Engineering; Chemical Engineering; Bioengineering and Biomedical Engineering; Biology; Materials Engineering; ,7%,"20,247",1490-1570,720-770,770-800,72%
1,Stanford University,https://www.niche.com/colleges/stanford-university/,A+,A+,A+,A+,A+,B+,A+,B,A,A,A+,B-,"Stanford is an elite private university located in Stanford, California in the San Francisco Bay Area. It is a mid-size institution with an enrollment of 7,064 undergraduate students. Admissions is extremely competitive as the Stanford acceptance rate is only 5%. Popular majors include Computer Science, Biology, and Engineering. Graduating 94% of students, Stanford alumni go on to earn a starting salary of $71,800.",450 Serra Mall,Stanford,CA,94305,5%,1390-1540,32-35,$90 ,"$16,562 ",Computer Science; Biology; Engineering; Liberal Arts and Humanities; Mechanical Engineering; Economics; Cognitive Science; Psychology; Electrical Engineering; International Relations; ,5%,"44,073",1390-1540,690-760,700-780,78%
2,Harvard University,https://www.niche.com/colleges/harvard-university/,A+,A+,A+,A,B+,A,A+,A+,A,B+,A+,B,"Harvard is an elite private university located in Cambridge, Massachusetts in the Boston Area. It is a mid-size institution with an enrollment of 7,147 undergraduate students. Admissions is extremely competitive as the Harvard acceptance rate is only 5%. Popular majors include Economics, Computer Science, and History. Graduating 96% of students, Harvard alumni go on to earn a starting salary of $69,700.",Massachusetts Hall,Cambridge,MA,2138,5%,1460-1590,32-35,$75 ,"$17,030 ",Economics; Computer Science; History; Political Science and Government; Social Science Research Methods; Research and Experimental Psychology; Public Health; Statistics; Ecology and Evolutionary Biology; Computational and Applied Mathematics; ,5%,"39,506",1460-1590,730-790,730-800,67%
3,Yale University,https://www.niche.com/colleges/yale-university/,A+,A+,A+,A+,A-,A,A+,B+,A+,A,A+,C,"Yale is an elite private university located in New Haven, Connecticut. It is a mid-size institution with an enrollment of 5,743 undergraduate students. Admissions is extremely competitive as the Yale acceptance rate is only 7%. Popular majors include Economics, Political Science and Government, and History. Graduating 97% of students, Yale alumni go on to earn a starting salary of $60,700.",38 Hillhouse Ave,New Haven,CT,6520,7%,1460-1580,32-35,$80 ,"$18,053 ",Economics; Political Science and Government; History; English; Cellular Biology; Liberal Arts and Humanities; Psychology; Information Science; International Relations; North American Studies; ,7%,"32,879",1460-1580,730-780,730-800,61%
4,Princeton University,https://www.niche.com/colleges/princeton-university/,A+,A+,A+,A-,A-,B,A+,B-,A-,A,A+,B+,"Princeton is an elite private university located in Princeton, New Jersey. It is a mid-size institution with an enrollment of 5,260 undergraduate students. Admissions is extremely competitive as the Princeton acceptance rate is only 6%. Popular majors include Computer Hardware Engineering, Economics, and Public Policy Analysis. Graduating 97% of students, Princeton alumni go on to earn a starting salary of $58,300.",1 Nassau Hall,Princeton,NJ,8544,6%,1430-1570,31-35,$65 ,"$16,302 ",Computer Hardware Engineering; Economics; Public Policy Analysis; History; Political Science and Government; Engineering; Biochemistry and Molecular Biology; Ecology and Evolutionary Biology; English; Research and Experimental Psychology; ,6%,"31,056",1430-1570,710-780,720-790,65%
5,University of Pennsylvania,https://www.niche.com/colleges/university-of-pennsylvania/,A+,A+,A,A,B+,A+,A+,A+,B-,B,A+,B,"Penn is an elite private university located in Philadelphia, Pennsylvania. It is a large institution with an enrollment of 10,496 undergraduate students. Admissions is extremely competitive as the Penn acceptance rate is only 9%. Popular majors include Finance, Nursing, and Economics. Graduating 96% of students, Penn alumni go on to earn a starting salary of $67,500.",34th & Spruce Street,Philadelphia,PA,19104,9%,1420-1560,32-35,$75 ,"$24,539 ",Finance; Nursing; Economics; Business; Political Science and Government; Biology; Philosophy; Operations Management; History; Information Science; ,9%,"40,413",1420-1560,700-770,720-790,46%
6,Columbia University,https://www.niche.com/colleges/columbia-university/,A+,A+,A+,A,B+,A,A+,A+,A-,A,A+,B,"Columbia is an elite private university located in Manhattan, New York in the New York City Area. It is a mid-size institution with an enrollment of 7,592 undergraduate students. Admissions is extremely competitive as the Columbia acceptance rate is only 7%. Popular majors include Economics, Computer Science, and Political Science and Government. Graduating 95% of students, Columbia alumni go on to earn a starting salary of $65,100.",West 116 St and Broadway,New York,NY,10027,7%,1410-1570,31-34,$85 ,"$22,824 ",Economics; Computer Science; Political Science and Government; Research and Experimental Psychology; History; Biology; Engineering; English; Philosophy; Mathematics; ,7%,"38,118",1410-1570,700-780,710-790,59%
7,Duke University,https://www.niche.com/colleges/duke-university/,A+,A+,A,A,A+,A-,A+,B-,B+,A,A+,C+,"Duke is an elite private university located in Durham, North Carolina in the Raleigh Area. It is a mid-size institution with an enrollment of 6,669 undergraduate students. Admissions is extremely competitive as the Duke acceptance rate is only 10%. Popular majors include Economics, Computer Science, and Public Policy Analysis. Graduating 95% of students, Duke alumni go on to earn a starting salary of $68,800.",2138 Campus Drive,Durham,NC,27708,10%,1380-1540,31-35,$85 ,"$22,011 ",Economics; Computer Science; Public Policy Analysis; Biology; Nursing; Bioengineering and Biomedical Engineering; Political Science and Government; Psychology; Electrical Engineering; Mechanical Engineering; ,10%,"33,077",1380-1540,670-750,710-790,31%
8,Brown University,https://www.niche.com/colleges/brown-university/,A+,A+,A+,A-,B+,A,A+,A,B,B+,A+,B-,"Brown is an elite private university located in Providence, Rhode Island. It is a mid-size institution with an enrollment of 6,666 undergraduate students. Admissions is extremely competitive as the Brown acceptance rate is only 8%. Popular majors include Biology, Economics, and Computer Science. Graduating 95% of students, Brown alumni go on to earn a starting salary of $49,600.",One Prospect Street,Providence,RI,2912,8%,1400-1570,31-35,$75 ,"$25,651 ",Biology; Economics; Computer Science; Computational and Applied Mathematics; Engineering; Entrepreneurship; Neuroscience and Neurobiology; History; International Relations; Political Science and Government; ,8%,"32,723",1400-1570,700-780,700-790,55%
9,California Institute of Technology,https://www.niche.com/colleges/california-institute-of-technology/,A+,A+,A,B+,B-,B,A+,A-,A-,B,A,B,"Caltech is an elite private college located in Pasadena, California in the Los Angeles Area. It is a small institution with an enrollment of 961 undergraduate students. Admissions is extremely competitive as the Caltech acceptance rate is only 8%. Popular majors include Computer Science, Mechanical Engineering, and Physics. Graduating 89% of students, Caltech alumni go on to earn a starting salary of $65,100.",1200 E California Blvd,Pasadena,CA,91125,8%,1530-1590,34-35,$75 ,"$24,466 ",Computer Science; Mechanical Engineering; Physics; Chemistry; Electrical Engineering; Computational and Applied Mathematics; Chemical Engineering; Mathematics; Bioengineering and Biomedical Engineering; Biology; ,8%,"7,339",1530-1590,750-790,780-800,65%
10,Rice University,https://www.niche.com/colleges/rice-university/,A+,A+,A+,A+,A,A-,A+,B+,A+,A+,A+,B-,"Rice is a highly rated private university located in Houston, Texas. It is a small institution with an enrollment of 3,916 undergraduate students. Admissions is competitive as the Rice acceptance rate is 16%. Popular majors include Economics, Information Science, and Chemical Engineering. Graduating 91% of students, Rice alumni go on to earn a starting salary of $54,200.",6100 S Main St,Houston,TX,77005,16%,1490-1580,33-35,$75 ,"$24,131 ",Economics; Information Science; Chemical Engineering; Biochemistry and Molecular Biology; Mechanical Engineering; Kinesiology and Exercise Science; Cognitive Science; Psychology; Sport and Fitness Management; Architecture; ,16%,"18,063",1490-1580,730-780,760-800,60%
11,University of Notre Dame,https://www.niche.com/colleges/university-of-notre-dame/,A+,A+,A-,A+,A+,A-,A+,C,A,A+,A+,B,"Notre Dame is a highly rated private, Catholic university located in Portage Township, Indiana in the South Bend Area. It is a mid-size institution with an enrollment of 8,557 undergraduate students. Admissions is competitive as the Notre Dame acceptance rate is 19%. Popular majors include Finance, Accounting, and Economics. Graduating 95% of students, Notre Dame alumni go on to earn a starting salary of $56,800.",400 Main Building,Notre Dame,IN,46556,19%,1370-1520,32-34,$75 ,"$27,453 ",Finance; Accounting; Economics; Political Science and Government; Mathematics; Pre-Medicine Studies; Psychology; Mechanical Engineering; Marketing; Chemical Engineering; ,19%,"19,564",1370-1520,680-750,690-770,36%
12,Northwestern University,https://www.niche.com/colleges/northwestern-university/,A+,A+,A,A,A,A-,A+,A,B,B,A+,B,"Northwestern is an elite private university located in Evanston, Illinois in the Chicago Area. It is a mid-size institution with an enrollment of 8,205 undergraduate students. Admissions is extremely competitive as the Northwestern acceptance rate is only 9%. Popular majors include Economics, Communications, and Psychology. Graduating 94% of students, Northwestern alumni go on to earn a starting salary of $57,300.",633 Clark St,Evanston,IL,60208,9%,1420-1560,32-34,$75 ,"$26,099 ",Economics; Communications; Psychology; Journalism; Political Science and Government; Biology; Industrial Engineering; Radio and Television; Mechanical Engineering; Drama and Theatre Production; ,9%,"37,259",1420-1560,700-770,720-790,35%
13,Pomona College,https://www.niche.com/colleges/pomona-college/,A+,A+,A+,A+,B-,B,A+,B+,A+,A+,A+,B,"Pomona is an elite private college located in Claremont, California in the Los Angeles Area. It is a small institution with an enrollment of 1,578 undergraduate students. Admissions is extremely competitive as the Pomona acceptance rate is only 8%. Popular majors include Economics, Computer Science, and Mathematics. Graduating 93% of students, Pomona alumni go on to earn a starting salary of $36,300.",550 N College Ave,Claremont,CA,91711,8%,1370-1530,30-34,$70 ,"$18,427 ",Economics; Computer Science; Mathematics; Psychology; Neuroscience and Neurobiology; Political Science and Government; International Relations; Biology; Environmental Science; Biochemistry and Molecular Biology; ,8%,"9,045",1370-1530,690-760,680-770,52%
14,Dartmouth College,https://www.niche.com/colleges/dartmouth-college/,A+,A+,A,B+,A-,B+,A+,C,B+,A,A,B,"Dartmouth is a highly rated private college located in Hanover, New Hampshire. It is a small institution with an enrollment of 4,360 undergraduate students. Admissions is extremely competitive as the Dartmouth acceptance rate is 10%. Popular majors include Economics, Political Science and Government, and Computer Science. Graduating 96% of students, Dartmouth alumni go on to earn a starting salary of $54,700.",207 Parkhurst Hall,Hanover,NH,3755,10%,1430-1560,30-34,$80 ,"$22,303 ",Economics; Political Science and Government; Computer Science; Engineering Science; History; Biology; Neuroscience and Neurobiology; Psychology; Mathematics; Geography; ,10%,"20,035",1430-1560,710-770,720-790,52%
15,University of Southern California,https://www.niche.com/colleges/university-of-southern-california/,A+,A+,A+,A+,A+,A+,A+,B+,A-,A-,A+,B,"USC is a highly rated private university located in Los Angeles, California. It is a large institution with an enrollment of 18,631 undergraduate students. Admissions is competitive as the USC acceptance rate is 17%. Popular majors include Business, Communications, and Biology. Graduating 92% of students, USC alumni go on to earn a starting salary of $52,800.",University Park,Los Angeles,CA,90089,17%,1300-1500,30-34,$80 ,"$32,892 ","Business; Communications; Biology; Accounting; International Relations; Economics; Computer Science; Psychology; Urban, Community and Regional Planning; Film and Video Studies; ",17%,"56,676",1300-1500,650-730,650-770,55%
16,Cornell University,https://www.niche.com/colleges/cornell-university/,A+,A+,A+,A-,B+,A,A+,B-,C+,A+,A,B,"Cornell is a highly rated private university located in Ithaca, New York. It is a large institution with an enrollment of 14,898 undergraduate students. Admissions is extremely competitive as the Cornell acceptance rate is 13%. Popular majors include Biology, Computer Science, and Business. Graduating 93% of students, Cornell alumni go on to earn a starting salary of $60,000.",300 Day Hall,Ithaca,NY,14853,13%,1390-1550,31-34,$80 ,"$31,449 ",Biology; Computer Science; Business; Hospitality and Tourism Management; Agricultural Business; Economics; Mechanical Engineering; Engineering; Political Science and Government; Animal Sciences and Husbandry; ,13%,"47,039",1390-1550,690-760,700-790,64%
17,Georgetown University,https://www.niche.com/colleges/georgetown-university/,A+,A+,A,B,A-,A,A+,A+,C+,C+,A+,C+,"Georgetown is a highly rated private, Catholic university located in Washington, D.C. It is a mid-size institution with an enrollment of 6,987 undergraduate students. Admissions is competitive as the Georgetown acceptance rate is 16%. Popular majors include Political Science and Government, International Relations, and Finance. Graduating 95% of students, Georgetown alumni go on to earn a starting salary of $61,900.",37th and O St NW,Washington,DC,20057,16%,1350-1520,30-34,$75 ,"$27,420 ",Political Science and Government; International Relations; Finance; Economics; Liberal Arts and Humanities; English; Psychology; Marketing; Business; International Business; ,16%,"21,462",1350-1520,680-760,670-760,68%
18,University of Michigan - Ann Arbor,https://www.niche.com/colleges/university-of-michigan---ann-arbor/,A+,A+,A,A+,A+,A+,A+,A,B+,A+,A+,B-,"Michigan is a highly rated public university located in Ann Arbor, Michigan in the Detroit Area. It is a large institution with an enrollment of 28,702 undergraduate students. Admissions is competitive as the Michigan acceptance rate is 27%. Popular majors include Information Science, Business, and Research and Experimental Psychology. Graduating 92% of students, Michigan alumni go on to earn a starting salary of $49,600.",503 Thompson Street,Ann Arbor,MI,48109,27%,1330-1500,30-33,$75 ,"$16,408 ",Information Science; Business; Research and Experimental Psychology; Economics; Political Science and Government; Physiological Psychology; Mechanical Engineering; Communications; Neuroscience and Neurobiology; Industrial Engineering; ,27%,"59,886",1330-1500,660-730,670-770,53%
19,Amherst College,https://www.niche.com/colleges/amherst-college/,A+,A+,A+,A-,A,B,A+,B+,A,B-,A+,A-,"Amherst is a highly rated private college located in Amherst Center, Massachusetts in the Springfield, MA Area. It is a small institution with an enrollment of 1,836 undergraduate students. Admissions is extremely competitive as the Amherst acceptance rate is 13%. Popular majors include Economics, Research and Experimental Psychology, and Mathematics. Graduating 95% of students, Amherst alumni go on to earn a starting salary of $42,300.",Boltwood Avenue,Amherst,MA,1002,13%,1400-1560,32-34,$60 ,"$19,519 ",Economics; Research and Experimental Psychology; Mathematics; English; Political Science and Government; Biology; Computer Science; History; Environmental Science; Sociology; ,13%,"9,285",1400-1560,700-770,700-790,33%
20,Tufts University,https://www.niche.com/colleges/tufts-university/,A+,A+,A,A-,B,B+,A+,A+,B,A+,A+,B-,"Tufts is a highly rated private university located in Somerville, Massachusetts in the Boston Area. It is a mid-size institution with an enrollment of 5,483 undergraduate students. Admissions is extremely competitive as the Tufts acceptance rate is 15%. Popular majors include Economics, Biology, and International Relations. Graduating 93% of students, Tufts alumni go on to earn a starting salary of $50,600.",4 Colby St.,Medford,MA,2155,15%,1410-1540,31-34,$75 ,"$29,449 ",Economics; Biology; International Relations; Computer Science; Political Science and Government; Public Health; Arts; Research and Experimental Psychology; English; Mechanical Engineering; ,15%,"21,101",1410-1540,700-760,710-780,34%
21,Johns Hopkins University,https://www.niche.com/colleges/johns-hopkins-university/,A+,A+,A,B,C+,B+,A+,B,B,B+,A-,B-,"Johns Hopkins is a highly rated private university located in Baltimore, Maryland. It is a mid-size institution with an enrollment of 5,668 undergraduate students. Admissions is extremely competitive as the Johns Hopkins acceptance rate is 13%. Popular majors include Public Health, Nursing, and International Relations. Graduating 93% of students, Johns Hopkins alumni go on to earn a starting salary of $62,700.",3400 N. Charles Street,Baltimore,MD,21218,13%,1450-1570,33-35,$70 ,"$29,066 ",Public Health; Nursing; International Relations; Bioengineering and Biomedical Engineering; Economics; Neuroscience and Neurobiology; Chemical Engineering; Cellular Biology; Music Performance; Mathematics; ,13%,"27,156",1450-1570,720-770,730-800,43%
22,Emory University,https://www.niche.com/colleges/emory-university/,A+,A+,A+,A,B-,B+,A+,A,A,B,A,B,"Emory is a highly rated private, Christian university located in Druid Hills, Georgia in the Atlanta Area. It is a mid-size institution with an enrollment of 6,794 undergraduate students. Admissions is competitive as the Emory acceptance rate is 22%. Popular majors include Business, Biology, and Nursing. Graduating 91% of students, Emory alumni go on to earn a starting salary of $53,200.","408 Administration Building, 201 Dowman Drive",Atlanta,GA,30322,22%,1350-1520,30-33,$75 ,"$26,867 ",Business; Biology; Nursing; Economics; Psychology; Neuroscience and Neurobiology; Chemistry; Physical Education Teaching and Coaching; Political Science and Government; Computational and Applied Mathematics; ,22%,"23,747",1350-1520,670-740,680-780,57%
23,University of Virginia,https://www.niche.com/colleges/university-of-virginia/,A+,A+,A,A,A+,A+,A+,A-,B,C+,A+,B-,"UVA is a highly rated public university located in Charlottesville, Virginia. It is a large institution with an enrollment of 15,766 undergraduate students. Admissions is competitive as the UVA acceptance rate is 27%. Popular majors include Liberal Arts and Humanities, Economics, and Business. Graduating 95% of students, UVA alumni go on to earn a starting salary of $48,300.",1827 University Avenue,Charlottesville,VA,22903,27%,1310-1500,29-33,$70 ,"$16,594 ",Liberal Arts and Humanities; Economics; Business; Biology; International Relations; Psychology; English; History; Political Science and Government; Information Science; ,27%,"36,779",1310-1500,660-740,650-760,74%
24,University of California - Los Angeles,https://www.niche.com/colleges/university-of-california---los-angeles/,A+,A+,A,A+,A+,A+,A+,A,A,A+,A+,B,"UCLA is a highly rated public university located in Los Angeles, California. It is a large institution with an enrollment of 30,458 undergraduate students. Admissions is competitive as the UCLA acceptance rate is 16%. Popular majors include Political Science and Government, Economics, and Psychology. Graduating 91% of students, UCLA alumni go on to earn a starting salary of $41,900.",405 Hilgard Ave,Los Angeles,CA,90095,16%,1220-1450,29-34,$70 ,"$14,760 ",Political Science and Government; Economics; Psychology; Sociology; Biology; Physiological Psychology; History; Computational and Applied Mathematics; English; Liberal Arts and Humanities; ,16%,"102,225",1220-1450,620-710,600-740,76%
25,Swarthmore College,https://www.niche.com/colleges/swarthmore-college/,A+,A+,A+,B-,B-,B-,A+,C+,A-,B-,A,B-,"Swarthmore is a highly rated private college located in Swarthmore, Pennsylvania in the Philadelphia Area. It is a small institution with an enrollment of 1,573 undergraduate students. Admissions is extremely competitive as the Swarthmore acceptance rate is 11%. Popular majors include Economics, Information Science, and Biology. Graduating 94% of students, Swarthmore alumni go on to earn a starting salary of $33,700.",500 College Ave,Swarthmore,PA,19081,11%,1380-1540,31-34,$60 ,"$20,444 ",Economics; Information Science; Biology; Mathematics; Engineering; Political Science and Government; Research and Experimental Psychology; Education; Sociology; Neuroscience and Neurobiology; ,11%,"9,382",1380-1540,690-760,690-780,58%
26,United States Military Academy at West Point,https://www.niche.com/colleges/united-states-military-academy-at-west-point/,A+,A+,B+,C-,C,C-,A,C,B-,B-,C+,A+,"West Point is an elite public college located in Highlands, New York. It is a small institution with an enrollment of 4,491 undergraduate students. Admissions is extremely competitive as the West Point acceptance rate is only 10%. Popular majors include Business, Mechanical Engineering, and Systems Engineering. West Point graduates 86% of its students.",646 Swift Road,West Point,NY,10996,10%,1180-1400,23-28,$0 ,$0 ,Business; Mechanical Engineering; Systems Engineering; Engineering; Economics; History; Military Science; Geography; Civil Engineering; Information Science; ,10%,"12,973",1180-1400,580-690,600-710,86%
27,Middlebury College,https://www.niche.com/colleges/middlebury-college/,A+,A+,A,A,B+,B-,A+,C+,A-,A+,A,B,"Middlebury is a highly rated private college located in Middlebury, Vermont. It is a small institution with an enrollment of 2,528 undergraduate students. Admissions is competitive as the Middlebury acceptance rate is 17%. Popular majors include Economics, Political Science and Government, and Environmental Science. Graduating 95% of students, Middlebury alumni go on to earn a starting salary of $41,600.",Old Chapel,Middlebury,VT,5753,17%,1320-1510,30-34,$65 ,"$22,841 ",Economics; Political Science and Government; Environmental Science; Neuroscience and Neurobiology; Psychology; Computer Science; Biochemistry and Molecular Biology; History; International Relations; English; ,17%,"8,909",1320-1510,660-750,660-760,49%
28,Barnard College,https://www.niche.com/colleges/barnard-college/,A+,A+,A,B+,NG,A,A+,A+,B-,B-,A+,B+,"Barnard is a highly rated private college located in Manhattan, New York in the New York City Area. It is a small institution with an enrollment of 2,514 undergraduate students. Admissions is extremely competitive as the Barnard acceptance rate is 15%. Popular majors include Psychology, Economics, and Political Science and Government. Graduating 93% of students, Barnard alumni go on to earn a starting salary of $44,100.",3009 Broadway,New York,NY,10027,15%,1310-1500,30-33,$75 ,"$23,736 ",Psychology; Economics; Political Science and Government; English; Art History; Neuroscience and Neurobiology; Urban Studies and Affairs; History; Liberal Arts and Humanities; Anthropology; ,15%,"7,716",1310-1500,660-760,650-740,50%
29,Washington & Lee University,https://www.niche.com/colleges/washington--and--lee-university/,A+,A+,B,B+,B-,A-,A+,B-,A,B,A,B-,"Washington & Lee is a highly rated private university located in Lexington, Virginia. It is a small institution with an enrollment of 1,823 undergraduate students. Admissions is competitive as the Washington & Lee acceptance rate is 22%. Popular majors include Business, Accounting, and Economics. Graduating 92% of students, Washington & Lee alumni go on to earn a starting salary of $46,700.",204 W Washington St,Lexington,VA,24450,22%,1350-1490,31-33,$60 ,"$25,029 ",Business; Accounting; Economics; Political Science and Government; English; Biology; Research and Experimental Psychology; History; Journalism; East Asian Languages and Literatures; ,22%,"5,455",1350-1490,680-740,670-750,35%
